{
  "schemaVersion": "autoloop.review-job/v1",
  "lineageId": "autoloop-auth1",
  "jobId": "autoloop-auth1.g0002",
  "generation": 2,
  "candidateIdentity": {
    "changedTreeIdentity": "83480174bd354bba9c28afe62bd7e05b5dcd37d6d29c041506097e3e68f2317c",
    "patchSha256": "d2dd770001f455e6c4f55b161dc928ae1a91f91a918436f471142f3377fb9c3b",
    "currentHead": "e1ecb45fb69778a4d85f0b968ed6847008d029ce",
    "baseHead": "a06124c8d919757c1a6371daaae89ab14546c9ef",
    "repository": "xonogesrs/autoloop",
    "branch": "governance/auth1-production-retrieval-authority"
  },
  "specId": "autoloop-auth1",
  "specDigest": "7e17e5a909740db5fa234378f419120b7e019ed6bc6453f2408e3ae52c8381dd",
  "reviewRound": 1,
  "repairRound": 0,
  "priorJobId": "autoloop-auth1.g0001",
  "supersedes": "autoloop-auth1.g0001",
  "state": "ACCEPTED",
  "stateVersion": 8,
  "requiredArtifacts": [
    {
      "role": "findings",
      "required": true,
      "writeMode": "exclusive-create"
    },
    {
      "role": "verdict",
      "required": true,
      "writeMode": "exclusive-create"
    }
  ],
  "priorFindingsDigest": "8a138cc0befab17b60c14bda9de4592406425c3883bfe82eb08d62615b541982",
  "priorVerdictDigest": "5515075d55a449acf89bf988db2550051500c3891a2fbf915c2bb83c2d2391d3",
  "repoIdentity": "xonogesrs/autoloop",
  "worktreeIdentity": "/Volumes/NVM2T/Development/autoloop",
  "findingsDigest": "6e08b91c7f10b897d8b201854c92d829182eb80f789048911fb28295b14475e1",
  "verdictDigest": "b44354063c7370810e7c1e8220263197ae03a1f4579a6bf8e968ea2a10f55569",
  "acceptedAt": "2026-08-16T08:00:28.982Z",
  "acceptanceAuthority": "controller"
}
